{
  "$schema": "./filter-plugin.schema.json",
  "schemaVersion": 1,
  "id": "org.example.warmth",
  "name": "Calidez personalizada",
  "version": "1.0.0",
  "description": "Aumenta rojo y reduce azul mediante un control externo.",
  "author": "Ejemplo CameraTuner",
  "parameters": [
    {
      "id": "warmth",
      "label": "Calidez",
      "minimum": -1,
      "maximum": 1,
      "step": 0.01,
      "defaultValue": 0
    }
  ],
  "processor": {
    "type": "colorMatrix",
    "base": [1, 0, 0, 0, 0, 1, 0, 0, 0, 0, 1, 0],
    "modulations": [
      { "parameter": "warmth", "coefficient": 0, "scale": 0.18 },
      { "parameter": "warmth", "coefficient": 10, "scale": -0.18 }
    ]
  }
}
